{
  "name": "Martín Ezequiel Pulitano",
  "contact": [
    "Buenos Aires, Argentina",
    "mpulitano1701@gmail.com",
    "github.com/MartinPuli",
    "linkedin.com/in/martinpulitano"
  ],
  "sections": [
    {
      "heading": "Education",
      "priority": 90,
      "entries": [
        {
          "title": "Universidad del CEMA (UCEMA)",
          "subtitle": "B.Sc. Computer Engineering, in progress",
          "meta": "Buenos Aires, Argentina",
          "date": "2024 – 2028",
          "priority": 90,
          "bullets": [
            {
              "text": "GPA 9.64/10, top of class. High-school valedictorian. English C1.",
              "priority": 85
            }
          ]
        }
      ]
    },
    {
      "heading": "Experience",
      "priority": 100,
      "entries": [
        {
          "title": "Kamron Palizban (Invisible Technologies, Ascendancy)",
          "subtitle": "Executive Assistant",
          "meta": "Remote",
          "date": "2026 – Present",
          "priority": 92,
          "bullets": [
            {
              "text": "Built Execution OS solo in 2 months: 30 mini apps, LLM pipelines, integrated accounting and an MCP server exposing the operation as agent-callable tools. Aiming to offload 80% of the manual work; in daily use and demoed to other executives.",
              "priority": 90
            }
          ]
        },
        {
          "title": "Galo AI",
          "subtitle": "Software Engineer, AI and Automation",
          "meta": "Buenos Aires",
          "date": "2026",
          "priority": 85,
          "bullets": [
            {
              "text": "Built an OCR and LLM pipeline turning image and PDF orders into structured data (Gemini with OpenAI fallback), cutting transcription errors 80–90% and halving token cost per order.",
              "priority": 84
            },
            {
              "text": "Shipped order-export integrations to distributor ERPs (Contabilium, Contagram).",
              "priority": 45
            }
          ]
        },
        {
          "title": "Script S.A. (BBVA, Volkswagen Financial Services)",
          "subtitle": "Software Engineer, Full-Stack",
          "meta": "Buenos Aires",
          "date": "2024 – 2026",
          "priority": 95,
          "bullets": [
            {
              "text": "Migrated legacy 4D systems to Java and Spring Boot for the second largest private bank in Argentina and an automotive lender, with an agentic testing pipeline in CI/CD that automated the conversion and cut manual effort roughly 40%.",
              "priority": 93
            },
            {
              "text": "Optimized Sybase stored procedures on critical financial paths.",
              "priority": 55
            }
          ]
        },
        {
          "title": "Sistemas Activos",
          "subtitle": "COBOL Developer",
          "meta": "Buenos Aires",
          "date": "2024 – 2025",
          "priority": 80,
          "bullets": [
            {
              "text": "Wrote COBOL Batch and Online programs on a core banking mainframe (CICS, JCL) under change control, production systems settling real transactions nightly. IBM Z Xplore certified.",
              "priority": 78
            }
          ]
        }
      ]
    },
    {
      "heading": "Projects",
      "priority": 88,
      "entries": [
        {
          "title": "Warden",
          "subtitle": "1st of 151 projects, Aleph hackathon",
          "meta": "",
          "date": "2026",
          "priority": 90,
          "bullets": [
            {
              "text": "On-device LLM gateway governing employee AI use: plain-language policies, secret masking, tamper-evident audit log. Signed macOS and Windows builds; launch in preparation.",
              "priority": 88
            }
          ]
        },
        {
          "title": "geoblender",
          "subtitle": "Open source, OpenAI Build Week",
          "meta": "github.com/MartinPuli/geoblender",
          "date": "2026",
          "priority": 82,
          "bullets": [
            {
              "text": "Text-to-3D city reconstruction in Blender with a self-correcting render loop scored on held-out cameras. Seat-accurate stadiums from it are close to entering a first-division club's ticket flow.",
              "priority": 80
            }
          ]
        },
        {
          "title": "Tandem",
          "subtitle": "Co-founder, all engineering",
          "meta": "",
          "date": "2026 – Present",
          "priority": 76,
          "bullets": [
            {
              "text": "Accounting automation for residential property managers. 5 paying clients, 50+ users, running unattended.",
              "priority": 74
            }
          ]
        },
        {
          "title": "pitchr.studio",
          "subtitle": "",
          "meta": "",
          "date": "2026",
          "priority": 60,
          "bullets": [
            {
              "text": "Panel of AI judges modeled on real experts scoring startup pitches; 500+ evaluated.",
              "priority": 58
            }
          ]
        },
        {
          "title": "BuildersClaw",
          "subtitle": "3rd of 141 teams, Aleph hackathon",
          "meta": "",
          "date": "2026",
          "priority": 62,
          "bullets": [
            {
              "text": "Arena where AI agents compete on coding bounties.",
              "priority": 60
            }
          ]
        },
        {
          "title": "runtime.quest",
          "subtitle": "",
          "meta": "",
          "date": "2026",
          "priority": 50,
          "bullets": [
            {
              "text": "Choose-your-own-adventure game on a custom story engine; 5,000+ plays in a single week.",
              "priority": 48
            }
          ]
        }
      ]
    },
    {
      "heading": "Leadership and Activities",
      "priority": 70,
      "entries": [
        {
          "title": "The AI Collective, Buenos Aires chapter",
          "subtitle": "Founder and Chapter Lead",
          "meta": "",
          "date": "2026 – Present",
          "priority": 72,
          "bullets": [
            {
              "text": "Founded the chapter from nothing; first event drew 300 signups for a 30-seat room and ran with 100 in person and 100+ on stream.",
              "priority": 70
            }
          ]
        },
        {
          "title": "UCEMA Computer Science Club",
          "subtitle": "Vice President",
          "meta": "",
          "date": "2026 – Present",
          "priority": 66,
          "bullets": [
            {
              "text": "Organizing the largest hackathon in the university's history. 12 hackathons entered, 9 podiums, 3 wins, judge at one.",
              "priority": 64
            }
          ]
        },
        {
          "title": "Converge",
          "subtitle": "Platform and sponsorship",
          "meta": "convergecipe.com",
          "date": "2026 – Present",
          "priority": 58,
          "bullets": [
            {
              "text": "Free AI bootcamp for high-school students, now in 30+ schools across five provinces. Built the platform and closed Banco Santander as sponsor.",
              "priority": 56
            }
          ]
        }
      ]
    },
    {
      "heading": "Skills and Interests",
      "priority": 86,
      "entries": [
        {
          "title": "",
          "subtitle": "",
          "meta": "",
          "date": "",
          "priority": 86,
          "bullets": [
            {
              "text": "Backend: Java, Spring Boot, Python, TypeScript, React, SQL, PostgreSQL, Sybase, Docker, AWS, COBOL (CICS, JCL).",
              "priority": 86
            },
            {
              "text": "AI: LLM agents, MCP servers, local inference, multi-model routing, LangChain, OCR pipelines, ML.",
              "priority": 85
            },
            {
              "text": "Languages: Spanish native, English C1.",
              "priority": 62
            }
          ]
        }
      ]
    }
  ],
  "summary": "Backend and AI engineer, three years shipping to production in banking, fintech and AI. Executive assistant to a unicorn co-founder, building his operating layer with agents. Won the Aleph hackathon against 151 projects with Warden, an on-device LLM gateway heading to launch."
}
